{
  "schema_version": "0.1.0",
  "operator_id": "org.latentdeck.builtin.ld_d2",
  "operator_version": "0.1.0",
  "trust": "builtin",
  "entrypoint": "latentdeck_operator_d2:process_slot",
  "supported_profiles": [
    {
      "codec_family": "minimax_h3",
      "profile": "h3_av_latent",
      "profile_version": "0.1.0",
      "timing_contract": "minimax_h3_causal",
      "timing_contract_version": "0.1.0",
      "layout": "[1,24,1,H,W]",
      "runtime_dtype": "F16"
    }
  ],
  "algorithms": ["LINEAR", "XS1", "XS2", "XS3", "XS4", "XS5"],
  "controls": {
    "algorithm": { "type": "enum", "default": "LINEAR", "values": ["LINEAR", "XS1", "XS2", "XS3", "XS4", "XS5"] },
    "mix": { "type": "float", "default": 0.5, "minimum": 0.0, "maximum": 1.0 },
    "mode": { "type": "enum", "default": "HYBRIDIZE", "values": ["HYBRIDIZE", "INTERACT"] },
    "routing": { "type": "enum", "default": "A", "values": ["A", "B"] },
    "interaction": { "type": "float", "default": 0.0, "minimum": 0.0, "maximum": 1.0 },
    "preserve": { "type": "float", "default": 0.55, "minimum": 0.0, "maximum": 1.0 },
    "chaos": { "type": "float", "default": 0.0, "minimum": 0.0, "maximum": 1.0 },
    "xs1_channel_a": { "type": "integer", "default": 0, "minimum": 0, "maximum": 23 },
    "xs1_channel_b": { "type": "integer", "default": 1, "minimum": 0, "maximum": 23 },
    "xs1_angle_degrees": { "type": "float", "default": 30.0, "minimum": -180.0, "maximum": 180.0 },
    "xs2_radius": { "type": "integer", "default": 1, "minimum": 1, "maximum": 8 },
    "xs3_high_gain": { "type": "float", "default": 0.5, "minimum": -2.0, "maximum": 2.0 },
    "xs4_epsilon": { "type": "float", "default": 0.000001, "minimum": 0.00000001, "maximum": 0.001 },
    "xs5_routing": { "type": "enum", "default": "TOPK", "values": ["TOPK", "SINKHORN"] },
    "temperature": { "type": "float", "default": 0.12, "minimum": 0.02, "maximum": 1.0 },
    "top_k": { "type": "integer", "default": 8, "minimum": 1, "maximum": 64 },
    "sinkhorn_iterations": { "type": "integer", "default": 5, "minimum": 2, "maximum": 12 }
  },
  "limits": {
    "max_spatial_tokens": 4096,
    "top_k_max": 64,
    "sinkhorn_iterations_max": 12
  }
}
